{"arm_summaries":[{"arm":"A_direct_reads","critical_omission_count":0,"incremental_refresh_p95_ms":null,"quality_basis_points":9000,"task_wall_p95_ms":250,"total_net_tokens":2000},{"arm":"B_existing_memory","critical_omission_count":0,"incremental_refresh_p95_ms":null,"quality_basis_points":9000,"task_wall_p95_ms":250,"total_net_tokens":2000},{"arm":"C_memory_candidate_index","critical_omission_count":0,"incremental_refresh_p95_ms":null,"quality_basis_points":9000,"task_wall_p95_ms":250,"total_net_tokens":2000}],"content_hash":"7b31e0c12111a288084f0fab481d924333a927750554e96321fc970d71f88632","decision":"not_evaluable","format":"world-forge.codebase_memory_benchmark_report","format_version":1,"gates":[{"gate_id":"full_net_token_reduction","passed":false,"reason_codes":["not_measured"]},{"gate_id":"maximum_critical_omissions","passed":false,"reason_codes":["not_measured"]},{"gate_id":"maximum_incremental_p95","passed":false,"reason_codes":["not_measured"]},{"gate_id":"maximum_quality_loss","passed":false,"reason_codes":["not_measured"]},{"gate_id":"structural_net_token_reduction","passed":false,"reason_codes":["not_measured"]},{"gate_id":"tree_unchanged","passed":false,"reason_codes":["not_measured"]},{"gate_id":"zero_unauthorized_egress","passed":false,"reason_codes":["not_measured"]}],"observation_refs":[{"content_hash":"2dc89edd88171f0b2b6d3e4d0890527d766da4f3d62c3957c131c9d88fa72c89","format":"world-forge.codebase_memory_benchmark_observation","format_version":1,"id":"navigation_01_a_01"},{"content_hash":"8f073d56b14b9a1afc4440d7f03e58e9be6742f88dc4e59e3db3f5e129075178","format":"world-forge.codebase_memory_benchmark_observation","format_version":1,"id":"navigation_01_b_01"},{"content_hash":"84a9716e54202bb13d39cec574b9645a3617e241e4ee2bcae8a741b48d2ecdee","format":"world-forge.codebase_memory_benchmark_observation","format_version":1,"id":"navigation_01_c_01"},{"content_hash":"7e3fd1717038f701d6bfc08814303de5ff25d00ade9fb3445cb7f4f79776c7af","format":"world-forge.codebase_memory_benchmark_observation","format_version":1,"id":"other_01_a_01"},{"content_hash":"6b363d11fedd99a68b267b782e293c945361580c4b5bde48f5cac1681243dc57","format":"world-forge.codebase_memory_benchmark_observation","format_version":1,"id":"other_01_b_01"},{"content_hash":"d5192fe7d97aa5177ad68179e974ed20320b0231ecdd493ea93c240c3c7b1307","format":"world-forge.codebase_memory_benchmark_observation","format_version":1,"id":"other_01_c_01"}],"plan":{"content_hash":"21d0d72067f6f180a83aac8ccf71185a13e19c8a8804186c53866d54f8f42886","format":"world-forge.codebase_memory_benchmark_plan","format_version":1,"id":"benchmark_01"},"reason_codes":["candidate_evidence_incomplete"],"report_id":"report_01"}
